<?xml version="1.0" encoding="windows-1251"?>
<!DOCTYPE passport SYSTEM "passport.dtd">
<?xml-stylesheet type="text/css" href="passport.css"?>
<passport>
    <header>Національний Паспорт</header>
    <photo>photo.jpg</photo>
    <details>
        <first_name>Хосе</first_name>
        <last_name>Петров</last_name>
        <middle_name>Іванович</middle_name>
        <address>Київ, вул. Шевченка, 12</address>
        <id_number>ІПН:123456789</id_number>
    </details>
    <footer>001333012293</footer>
</passport>
